{
  "$schema": "https://json-schema.org/draft/2020-12/schema",
  "$id": "urn:jobleft:contracts:ProfileInput",
  "title": "ProfileInput",
  "description": "The editable part of the profile",
  "type": "object",
  "properties": {
    "personal": {
      "type": "object",
      "properties": {
        "firstName": {
          "anyOf": [
            {
              "type": "string"
            },
            {
              "type": "null"
            }
          ]
        },
        "middleName": {
          "anyOf": [
            {
              "type": "string"
            },
            {
              "type": "null"
            }
          ]
        },
        "lastName": {
          "anyOf": [
            {
              "type": "string"
            },
            {
              "type": "null"
            }
          ]
        },
        "email": {
          "anyOf": [
            {
              "type": "string"
            },
            {
              "type": "null"
            }
          ]
        },
        "phone": {
          "anyOf": [
            {
              "type": "string"
            },
            {
              "type": "null"
            }
          ]
        },
        "addressLine": {
          "anyOf": [
            {
              "type": "string"
            },
            {
              "type": "null"
            }
          ]
        },
        "city": {
          "anyOf": [
            {
              "type": "string"
            },
            {
              "type": "null"
            }
          ]
        },
        "region": {
          "anyOf": [
            {
              "type": "string"
            },
            {
              "type": "null"
            }
          ]
        },
        "postalCode": {
          "anyOf": [
            {
              "type": "string"
            },
            {
              "type": "null"
            }
          ]
        },
        "country": {
          "anyOf": [
            {
              "type": "string",
              "pattern": "^[A-Z]{2}$",
              "description": "ISO 3166-1 alpha-2"
            },
            {
              "type": "null"
            }
          ]
        },
        "links": {
          "type": "array",
          "items": {
            "type": "object",
            "properties": {
              "label": {
                "type": "string"
              },
              "url": {
                "type": "string",
                "format": "uri",
                "pattern": "^https?://",
                "maxLength": 4096,
                "description": "Absolute http(s) URL"
              }
            },
            "required": [
              "label",
              "url"
            ],
            "title": "Link"
          }
        }
      },
      "required": [
        "firstName",
        "middleName",
        "lastName",
        "email",
        "phone",
        "addressLine",
        "city",
        "region",
        "postalCode",
        "country",
        "links"
      ],
      "title": "Personal"
    },
    "summary": {
      "anyOf": [
        {
          "type": "string"
        },
        {
          "type": "null"
        }
      ]
    },
    "education": {
      "type": "array",
      "items": {
        "type": "object",
        "properties": {
          "id": {
            "type": "string",
            "minLength": 1,
            "maxLength": 300
          },
          "school": {
            "type": "string"
          },
          "degree": {
            "anyOf": [
              {
                "type": "string"
              },
              {
                "type": "null"
              }
            ]
          },
          "major": {
            "anyOf": [
              {
                "type": "string"
              },
              {
                "type": "null"
              }
            ]
          },
          "gpa": {
            "anyOf": [
              {
                "type": "string"
              },
              {
                "type": "null"
              }
            ]
          },
          "startDate": {
            "anyOf": [
              {
                "type": "string",
                "pattern": "^\\d{4}(-(0[1-9]|1[0-2]))?$",
                "description": "YYYY or YYYY-MM"
              },
              {
                "type": "null"
              }
            ]
          },
          "endDate": {
            "anyOf": [
              {
                "type": "string",
                "pattern": "^\\d{4}(-(0[1-9]|1[0-2]))?$",
                "description": "YYYY or YYYY-MM"
              },
              {
                "type": "null"
              }
            ]
          },
          "current": {
            "type": "boolean"
          },
          "achievements": {
            "type": "array",
            "items": {
              "type": "string"
            }
          },
          "coursework": {
            "type": "array",
            "items": {
              "type": "string"
            }
          }
        },
        "required": [
          "id",
          "school",
          "degree",
          "major",
          "gpa",
          "startDate",
          "endDate",
          "current",
          "achievements",
          "coursework"
        ],
        "title": "EducationEntry"
      }
    },
    "work": {
      "type": "array",
      "items": {
        "type": "object",
        "properties": {
          "id": {
            "type": "string",
            "minLength": 1,
            "maxLength": 300
          },
          "company": {
            "type": "string"
          },
          "title": {
            "type": "string"
          },
          "employmentType": {
            "anyOf": [
              {
                "type": "string",
                "enum": [
                  "full_time",
                  "part_time",
                  "contract",
                  "internship",
                  "temporary",
                  "other"
                ]
              },
              {
                "type": "null"
              }
            ]
          },
          "location": {
            "anyOf": [
              {
                "type": "string"
              },
              {
                "type": "null"
              }
            ]
          },
          "startDate": {
            "anyOf": [
              {
                "type": "string",
                "pattern": "^\\d{4}(-(0[1-9]|1[0-2]))?$",
                "description": "YYYY or YYYY-MM"
              },
              {
                "type": "null"
              }
            ]
          },
          "endDate": {
            "anyOf": [
              {
                "type": "string",
                "pattern": "^\\d{4}(-(0[1-9]|1[0-2]))?$",
                "description": "YYYY or YYYY-MM"
              },
              {
                "type": "null"
              }
            ]
          },
          "current": {
            "type": "boolean"
          },
          "summary": {
            "anyOf": [
              {
                "type": "string"
              },
              {
                "type": "null"
              }
            ]
          },
          "bullets": {
            "type": "array",
            "items": {
              "type": "string"
            }
          }
        },
        "required": [
          "id",
          "company",
          "title",
          "employmentType",
          "location",
          "startDate",
          "endDate",
          "current",
          "summary",
          "bullets"
        ],
        "title": "WorkEntry"
      }
    },
    "projects": {
      "type": "array",
      "items": {
        "type": "object",
        "properties": {
          "id": {
            "type": "string",
            "minLength": 1,
            "maxLength": 300
          },
          "name": {
            "type": "string"
          },
          "description": {
            "anyOf": [
              {
                "type": "string"
              },
              {
                "type": "null"
              }
            ]
          },
          "url": {
            "anyOf": [
              {
                "type": "string",
                "format": "uri",
                "pattern": "^https?://",
                "maxLength": 4096,
                "description": "Absolute http(s) URL"
              },
              {
                "type": "null"
              }
            ]
          },
          "startDate": {
            "anyOf": [
              {
                "type": "string",
                "pattern": "^\\d{4}(-(0[1-9]|1[0-2]))?$",
                "description": "YYYY or YYYY-MM"
              },
              {
                "type": "null"
              }
            ]
          },
          "endDate": {
            "anyOf": [
              {
                "type": "string",
                "pattern": "^\\d{4}(-(0[1-9]|1[0-2]))?$",
                "description": "YYYY or YYYY-MM"
              },
              {
                "type": "null"
              }
            ]
          },
          "bullets": {
            "type": "array",
            "items": {
              "type": "string"
            }
          }
        },
        "required": [
          "id",
          "name",
          "description",
          "url",
          "startDate",
          "endDate",
          "bullets"
        ],
        "title": "ProjectEntry"
      }
    },
    "certifications": {
      "type": "array",
      "items": {
        "type": "object",
        "properties": {
          "name": {
            "type": "string"
          },
          "issuer": {
            "anyOf": [
              {
                "type": "string"
              },
              {
                "type": "null"
              }
            ]
          },
          "date": {
            "anyOf": [
              {
                "type": "string",
                "pattern": "^\\d{4}(-(0[1-9]|1[0-2]))?$",
                "description": "YYYY or YYYY-MM"
              },
              {
                "type": "null"
              }
            ]
          }
        },
        "required": [
          "name",
          "issuer",
          "date"
        ]
      }
    },
    "skills": {
      "type": "array",
      "items": {
        "type": "object",
        "properties": {
          "name": {
            "type": "string",
            "minLength": 1
          },
          "years": {
            "anyOf": [
              {
                "type": "number",
                "minimum": 0,
                "maximum": 60
              },
              {
                "type": "null"
              }
            ]
          },
          "source": {
            "type": "string",
            "enum": [
              "resume",
              "user"
            ]
          }
        },
        "required": [
          "name",
          "years",
          "source"
        ],
        "title": "SkillEntry"
      }
    },
    "preferences": {
      "type": "object",
      "properties": {
        "jobFunctions": {
          "type": "array",
          "items": {
            "type": "string"
          }
        },
        "targetTitles": {
          "type": "array",
          "items": {
            "type": "string"
          }
        },
        "employmentTypes": {
          "type": "array",
          "items": {
            "type": "string",
            "enum": [
              "full_time",
              "part_time",
              "contract",
              "internship",
              "temporary",
              "other"
            ]
          }
        },
        "workModels": {
          "type": "array",
          "items": {
            "type": "string",
            "enum": [
              "onsite",
              "hybrid",
              "remote"
            ]
          }
        },
        "levels": {
          "type": "array",
          "items": {
            "type": "string",
            "enum": [
              "intern_new_grad",
              "entry",
              "mid",
              "senior",
              "lead_staff",
              "director_exec"
            ]
          }
        },
        "countries": {
          "type": "array",
          "items": {
            "type": "string",
            "pattern": "^[A-Z]{2}$",
            "description": "ISO 3166-1 alpha-2"
          }
        },
        "places": {
          "type": "array",
          "items": {
            "type": "object",
            "properties": {
              "text": {
                "type": "string"
              },
              "placeId": {
                "anyOf": [
                  {
                    "type": "string"
                  },
                  {
                    "type": "null"
                  }
                ]
              },
              "radiusMiles": {
                "anyOf": [
                  {
                    "type": "number",
                    "minimum": 0,
                    "maximum": 500
                  },
                  {
                    "type": "null"
                  }
                ]
              }
            },
            "required": [
              "text",
              "placeId",
              "radiusMiles"
            ],
            "title": "PlaceQuery"
          }
        },
        "minAnnualPayUsd": {
          "anyOf": [
            {
              "type": "number",
              "minimum": 0
            },
            {
              "type": "null"
            }
          ]
        },
        "industries": {
          "type": "array",
          "items": {
            "type": "string"
          }
        },
        "companyStages": {
          "type": "array",
          "items": {
            "type": "string",
            "enum": [
              "early",
              "growth",
              "late",
              "public"
            ]
          }
        },
        "roleTypes": {
          "type": "array",
          "items": {
            "type": "string",
            "enum": [
              "ic",
              "manager"
            ]
          }
        },
        "excludedCompanies": {
          "type": "array",
          "items": {
            "type": "string"
          }
        }
      },
      "required": [
        "jobFunctions",
        "targetTitles",
        "employmentTypes",
        "workModels",
        "levels",
        "countries",
        "places",
        "minAnnualPayUsd",
        "industries",
        "companyStages",
        "roleTypes",
        "excludedCompanies"
      ],
      "title": "JobPreferences"
    },
    "workAuthorization": {
      "type": "object",
      "properties": {
        "usAuthorized": {
          "anyOf": [
            {
              "type": "string",
              "enum": [
                "yes",
                "no"
              ]
            },
            {
              "type": "null"
            }
          ]
        },
        "needsSponsorship": {
          "anyOf": [
            {
              "type": "string",
              "enum": [
                "yes",
                "no"
              ]
            },
            {
              "type": "null"
            }
          ]
        },
        "usCitizen": {
          "anyOf": [
            {
              "type": "string",
              "enum": [
                "yes",
                "no"
              ]
            },
            {
              "type": "null"
            }
          ]
        },
        "hasSecurityClearance": {
          "anyOf": [
            {
              "type": "string",
              "enum": [
                "yes",
                "no"
              ]
            },
            {
              "type": "null"
            }
          ]
        },
        "authorizedCountries": {
          "type": "array",
          "items": {
            "type": "string",
            "pattern": "^[A-Z]{2}$",
            "description": "ISO 3166-1 alpha-2"
          }
        }
      },
      "required": [
        "usAuthorized",
        "needsSponsorship",
        "usCitizen",
        "hasSecurityClearance",
        "authorizedCountries"
      ],
      "title": "WorkAuthorization"
    },
    "eeo": {
      "type": "object",
      "properties": {
        "disability": {
          "anyOf": [
            {
              "type": "string",
              "enum": [
                "yes",
                "no",
                "decline"
              ]
            },
            {
              "type": "null"
            }
          ]
        },
        "veteran": {
          "anyOf": [
            {
              "type": "string",
              "enum": [
                "yes",
                "no",
                "decline"
              ]
            },
            {
              "type": "null"
            }
          ]
        },
        "gender": {
          "anyOf": [
            {
              "type": "string"
            },
            {
              "type": "null"
            }
          ]
        },
        "lgbtq": {
          "anyOf": [
            {
              "type": "string",
              "enum": [
                "yes",
                "no",
                "decline"
              ]
            },
            {
              "type": "null"
            }
          ]
        },
        "race": {
          "anyOf": [
            {
              "type": "string"
            },
            {
              "type": "null"
            }
          ]
        },
        "hispanicOrLatino": {
          "anyOf": [
            {
              "type": "string",
              "enum": [
                "yes",
                "no",
                "decline"
              ]
            },
            {
              "type": "null"
            }
          ]
        },
        "sexualOrientation": {
          "type": "array",
          "items": {
            "type": "string"
          }
        },
        "pronouns": {
          "anyOf": [
            {
              "type": "string"
            },
            {
              "type": "null"
            }
          ]
        }
      },
      "required": [
        "disability",
        "veteran",
        "gender",
        "lgbtq",
        "race",
        "hispanicOrLatino",
        "sexualOrientation",
        "pronouns"
      ],
      "title": "EeoAnswers"
    },
    "declinedSkills": {
      "type": "array",
      "items": {
        "type": "string",
        "minLength": 1
      }
    },
    "extraSections": {
      "type": "array",
      "items": {
        "type": "object",
        "properties": {
          "id": {
            "type": "string",
            "minLength": 1,
            "maxLength": 300
          },
          "title": {
            "type": "string",
            "minLength": 1
          },
          "lines": {
            "type": "array",
            "items": {
              "type": "string"
            }
          }
        },
        "required": [
          "id",
          "title",
          "lines"
        ],
        "title": "ExtraSection"
      }
    }
  },
  "required": [
    "personal",
    "summary",
    "education",
    "work",
    "projects",
    "certifications",
    "skills",
    "preferences",
    "workAuthorization",
    "eeo"
  ]
}
